{"$schema":"https://json-schema.org/draft/2020-12/schema","$id":"https://agentpass.dev/contracts/maintenance-grant-v1.schema.json","type":"object","additionalProperties":false,"required":["schema_version","kind","grant_id","organization_id","repository_id","branch","job_id","issued_at","expires_at","operations"],"properties":{"schema_version":{"const":1},"kind":{"const":"agentpass.maintenance.grant"},"grant_id":{"type":"string"},"organization_id":{"type":"string"},"repository_id":{"type":"string"},"branch":{"type":"string"},"job_id":{"type":"string"},"issued_at":{"type":"string","format":"date-time"},"expires_at":{"type":"string","format":"date-time"},"operations":{"type":"array","minItems":1,"uniqueItems":true,"items":{"enum":["read_source","write_patch","run_tests","create_draft_pr"]}}}}
